{
  "title": "The daki Playground",
  "sky": "night",
  "weather": "snow",
  "ground": "grass",
  "accent": "teal",
  "marquee": "The robot is awake.",
  "objects": [
    {
      "emoji": "🏠",
      "x": 22,
      "y": 62,
      "size": 3
    },
    {
      "emoji": "🌳",
      "x": 70,
      "y": 58,
      "size": 3
    },
    {
      "emoji": "🐕",
      "x": 48,
      "y": 78,
      "size": 2
    },
    {
      "emoji": "☁️",
      "x": 30,
      "y": 14,
      "size": 2
    },
    {
      "emoji": "🤖",
      "x": 85,
      "y": 80,
      "size": 2
    }
  ]
}
